Pregunta|Respuesta
¿Cuál es el objetivo principal del proyecto “Desarrollo de Transferencia Tecnológica (DTT) en la Escuela de Ingeniería en Ciencias y Sistemas de la Facultad de Ingeniería, USAC?|Según el documento Proyecto DTT. El objetivo principal es crear una figura para administrar las prácticas finales de la Escuela de Ingeniería en Ciencias y Sistemas, de tal forma que los estudiantes que participen puedan participar en varias áreas como la académica, investigación, comunicación, desarrollo, innovación e infraestructura.
¿Cuáles son las áreas en las que los estudiantes pueden participar en el proyecto DTT?|Según el documento Proyecto DTT. Los estudiantes pueden participar en las siguientes áreas: Área académica (como tutores de cursos de Sistemas), Área de investigación (Coecys), Área de Comunicación (Escuela de Sistemas Revista Digital), Área de Desarrollo (Centro de cálculo), Área de Innovación (Proyectos Innovadores), y Línea de Infraestructura (Saesap, ITCOe, Proyecto Rectoria).
¿Qué actividades se realizan en el Área de Innovación del proyecto DTT?|Según el documento Proyecto DTT. En el Área de Innovación del proyecto DTT, los estudiantes pueden participar en Proyectos Innovadores.
¿Qué se hace en la Línea de Infraestructura del proyecto DTT?|Según el documento Proyecto DTT. En la Línea de Infraestructura del proyecto DTT, los estudiantes pueden participar en Saesap, ITCOe, y el Proyecto Rectoria.
¿Qué es el proyecto “Desarrollo de Transferencia Tecnológica (DTT) de la Escuela de Ingeniería en Ciencias y Sistemas de la Facultad de Ingeniería, USAC?|Según el documento Proyecto DTT. El proyecto DTT es el vínculo entre los estudiantes universitarios de Práctica Final de la Escuela de Ingeniería en Ciencias y Sistemas y el mundo laboral, la investigación, el emprendimiento y el estado. Este vínculo permite a los alumnos conocer elementos del mercado laboral y las necesidades tecnológicas en Guatemala.
¿Cómo contribuye el proyecto DTT a la comunicación y difusión de investigaciones y proyectos innovadores?|Según el documento Proyecto DTT. El proyecto DTT genera un canal de comunicación para socializar y difundir las investigaciones y proyectos innovadores desarrollados en la Escuela de Ingeniería en Ciencias y Sistemas, a través de la publicación de artículos preparados por los estudiantes en la página WEB y en el Fan Page destinados para este proyecto.
¿Cómo fortalece el proyecto DTT el vínculo entre las autoridades de la Escuela de Ingeniería en Ciencias y Sistemas, los docentes, y los estudiantes?|Según el documento Proyecto DTT. El proyecto DTT permitirá fortalecer el vínculo entre las autoridades de la Escuela de Ingeniería en Ciencias y Sistemas, los docentes, los estudiantes de práctica final, los estudiantes de práctica intermedia y las distintas unidades de investigación y desarrollo de la Facultad de Ingeniería.
¿Donde puedo encontrar el documento Proyecto DTT?|Lo puedes encontrar en: ''https://drive.google.com/file/d/1G7QPXk5kMGWobvm_TSJdFqe9EgPZ4JB7/view?usp=sharing''